{
  "date": "2026-04-25",
  "generated_at": "2026-04-25T06:46:00.233150+00:00",
  "generator_version": "1.0.0",
  "sources_polled": [
    "openai",
    "anthropic",
    "deepmind",
    "huggingface",
    "google-news-ai",
    "arxiv-cs-ai"
  ],
  "items": [
    {
      "rank": 1,
      "id": "2026-04-25-001",
      "title": "DeepSeek-V4: a million-token context that agents can actually use",
      "url": "https://huggingface.co/blog/deepseekv4",
      "source": "huggingface",
      "source_type": "official_blog",
      "published_at": "2026-04-24T00:00:00+00:00",
      "summary": "DeepSeek releases V4 model with a 1 million token context window optimized for agentic workflows. It delivers stable performance on long sequences, enabling agents to process massive inputs like full codebases or documents without degradation.",
      "why_it_matters": "This breakthrough allows AI builders to create more capable agents handling complex, long-horizon tasks. No more context truncation issues in RAG, coding, or planning. Boosts reliability for production agents, reduces engineering for summarization chains, and opens doors to novel applications in software dev, legal analysis, and research. Competitive edge over shorter-context rivals.",
      "suggested_reel_angle": "1M token context usable by agents? DeepSeek-V4 just dropped the mic!",
      "suggested_long_angle": [
        "New architecture for ultra-long contexts",
        "Agent benchmarks and real-world tests",
        "Quickstart integration with frameworks"
      ],
      "tags": [
        "model-release",
        "long-context",
        "agents",
        "deepseek"
      ],
      "related_registry_entries": [
        "deepseek-r2"
      ],
      "authority_score": 0.9,
      "virality_score": 0.7082,
      "recency_hours": 30
    },
    {
      "rank": 2,
      "id": "2026-04-25-002",
      "title": "Codex Automations: Schedules and Triggers for Recurring AI Workflows",
      "url": "https://openai.com/academy/codex-automations",
      "source": "openai",
      "source_type": "official_blog",
      "published_at": "2026-04-23T10:00:00+00:00",
      "summary": "OpenAI Codex introduces automations using schedules and triggers to generate reports, summaries, and workflows automatically from real inputs across tools and files, eliminating manual runs.",
      "why_it_matters": "Builders can now deploy persistent, event-driven AI pipelines easily. Perfect for productionizing prototypes into scheduled jobs like daily analytics or data processing. Integrates natively with OpenAI ecosystem, lowering dev time for agentic apps and boosting scalability without custom infra.",
      "suggested_reel_angle": "Automate your AI life with OpenAI Codex triggers - zero effort workflows!",
      "suggested_long_angle": [
        "Setting up schedules and triggers",
        "Example automations for reports",
        "Scaling to enterprise workflows"
      ],
      "tags": [
        "openai",
        "codex",
        "automation",
        "workflows",
        "agents"
      ],
      "related_registry_entries": [
        "langgraph",
        "autogen-04"
      ],
      "authority_score": 1.0,
      "virality_score": 0.7122,
      "recency_hours": 44
    },
    {
      "rank": 3,
      "id": "2026-04-25-003",
      "title": "Why AI CEOs Are Building Bunkers: Tristan Harris Transcript",
      "url": "https://news.google.com/rss/articles/CBMiigFBVV95cUxQRU1WcnZueXF0N3d4SU0yeEt5bjlNTThRLTFNZy1IUG1ES0RZS1ZNTTBIUklJQWl5UDVHbkNnN0Z1TnZtVloxZTVKbE9YV19SRml6NjVxWm5ETUl0Umw4Sjd0RHJMNFN5b1Bsd2NQdUl2aHFaQmFlLUFjRUNscmlNU01NVkt4VXZZVkE?oc=5",
      "source": "google-news-ai",
      "source_type": "news_aggregator",
      "published_at": "2026-04-25T06:02:08+00:00",
      "summary": "Tristan Harris details in transcript why leading AI executives are constructing bunkers, citing accelerating risks from superintelligent systems and societal upheaval.",
      "why_it_matters": "Signals elite consensus on severe AI downside risks, urging builders to prioritize alignment, safety layers, and scalable oversight. Influences VC priorities, policy, and hiring. Practitioners gain context for embedding safeguards in models and agents, avoiding future retrofits amid regulatory scrutiny.",
      "suggested_reel_angle": "AI CEOs bunkering up - Tristan Harris spills the real reasons!",
      "suggested_long_angle": [
        "Core risk scenarios outlined",
        "CEO preparations and motivations",
        "Actionable safety steps for devs"
      ],
      "tags": [
        "ai-safety",
        "existential-risk",
        "leadership"
      ],
      "related_registry_entries": [
        "constitutional-ai"
      ],
      "authority_score": 0.6,
      "virality_score": 0.76,
      "recency_hours": 0
    },
    {
      "rank": 4,
      "id": "2026-04-25-004",
      "title": "Nvidia\u2019s Bond with Gamers Fracturing over AI Shift",
      "url": "https://news.google.com/rss/articles/CBMinwFBVV95cUxNSjJpcnZ3UVFvc003SFFNY0t5Y29zUFc1dUU5M2Z5Skd6N2JoRkZPSnRMT0pyTDNrekFWZHpnUkk3M01Od1cySE5sNERZSm9ZWGlPNzE0VTlGUk9ROHR4Rl9DTTBERXp4MnhraGpJT3FLejJnZGxudWxzNzR4dUt4dDFxMnRZc0pYRF9TUFk5X2EzNE1CZVROSFBWYnRnaFk?oc=5",
      "source": "google-news-ai",
      "source_type": "news_aggregator",
      "published_at": "2026-04-25T05:56:00+00:00",
      "summary": "Nvidia's heavy AI focus is eroding loyalty from gamers, as high-end GPUs prioritize data centers over consumer gaming, sparking backlash and market shifts.",
      "why_it_matters": "Critical for builders using consumer GPUs for local inference and fine-tuning. Potential shortages or price surges affect accessibility of tools like Ollama. Highlights Nvidia's AI dominance but pushes innovation in efficient inference engines and alternatives like AMD or custom silicon.",
      "suggested_reel_angle": "Nvidia picks AI over gamers - chaos for your local LLMs?",
      "suggested_long_angle": [
        "Nvidia's AI revenue boom",
        "Gamer backlash and sales data",
        "Implications for AI hardware access"
      ],
      "tags": [
        "nvidia",
        "hardware",
        "ai-business"
      ],
      "related_registry_entries": [
        "vllm",
        "ollama"
      ],
      "authority_score": 0.6,
      "virality_score": 0.76,
      "recency_hours": 0
    },
    {
      "rank": 5,
      "id": "2026-04-25-005",
      "title": "DeepMind Partners with Industry Leaders to Accelerate AI Transformation",
      "url": "https://deepmind.google/blog/partnering-with-industry-leaders-to-accelerate-ai-transformation/",
      "source": "deepmind",
      "source_type": "official_blog",
      "published_at": "2026-04-21T14:54:15+00:00",
      "summary": "Google DeepMind collaborates with top global consultancies to integrate frontier AI into enterprises, providing customized solutions for organizational AI adoption.",
      "why_it_matters": "Eases deployment of models like Gemma for builders via consultancy expertise. Creates ecosystems for fine-tuning, integration, and scaling in sectors like finance and healthcare. Opportunities for partnerships, new datasets, and real-world benchmarks driving model improvements.",
      "suggested_reel_angle": "DeepMind + consultancies = Enterprise AI revolution incoming!",
      "suggested_long_angle": [
        "Key partners and their roles",
        "Target use cases across industries",
        "How builders can engage"
      ],
      "tags": [
        "deepmind",
        "partnerships",
        "enterprise-ai",
        "adoption"
      ],
      "related_registry_entries": [],
      "authority_score": 1.0,
      "virality_score": 0.6324,
      "recency_hours": 87
    }
  ]
}