{
  "date": "2026-05-10",
  "generated_at": "2026-05-10T07:10:21.271524+00:00",
  "generator_version": "1.0.0",
  "sources_polled": [
    "openai",
    "anthropic",
    "deepmind",
    "huggingface",
    "google-news-ai",
    "arxiv-cs-ai"
  ],
  "items": [
    {
      "rank": 1,
      "id": "2026-05-10-001",
      "title": "OncoAgent: A Dual-Tier Multi-Agent Framework for Privacy-Preserving Oncology Clinical Decision Support",
      "url": "https://huggingface.co/blog/lablab-ai-amd-developer-hackathon/oncoagent-official-paper",
      "source": "huggingface",
      "source_type": "official_blog",
      "published_at": "2026-05-09T18:09:28+00:00",
      "summary": "OncoAgent introduces a dual-tier multi-agent system for oncology clinical decision support. It enables privacy-preserving AI assistance in cancer treatment planning, developed from a Hugging Face hackathon. Agents collaborate to analyze data and recommend decisions without exposing sensitive patient information.",
      "why_it_matters": "AI builders in healthcare gain a blueprint for multi-agent systems handling sensitive data. Demonstrates privacy techniques like federated learning or differential privacy in agent workflows, scalable to clinical use. Accelerates adoption of agentic AI in regulated domains, with open paper for replication and extension.",
      "suggested_reel_angle": "Privacy-first AI agents revolutionizing cancer care! Hackathon breakthrough with OncoAgent.",
      "suggested_long_angle": [
        "Dual-tier agent architecture explained",
        "Privacy safeguards in oncology AI",
        "From hackathon to clinical impact"
      ],
      "tags": [
        "multi-agent",
        "healthcare-ai",
        "privacy-preserving",
        "oncology"
      ],
      "related_registry_entries": [
        "autogen-04",
        "langgraph"
      ],
      "authority_score": 0.9,
      "virality_score": 0.8148,
      "recency_hours": 13
    },
    {
      "rank": 2,
      "id": "2026-05-10-002",
      "title": "Simplex rethinks software development with Codex",
      "url": "https://openai.com/index/simplex",
      "source": "openai",
      "source_type": "official_blog",
      "published_at": "2026-05-07T00:00:00+00:00",
      "summary": "Simplex leverages ChatGPT Enterprise and Codex to streamline software design, building, and testing. Achieves major time reductions and scales AI-driven workflows for enterprise development teams.",
      "why_it_matters": "Highlights practical Codex integration for agentic coding, with quantifiable productivity gains. AI builders can adopt similar setups to automate dev pipelines, scale agent workflows, and compete in AI-accelerated software engineering. OpenAI case study provides implementation insights.",
      "suggested_reel_angle": "Slash dev time with Codex: Simplex's AI revolution!",
      "suggested_long_angle": [
        "Codex-powered dev workflows",
        "Enterprise scaling strategies",
        "Real metrics on time savings"
      ],
      "tags": [
        "codex",
        "software-engineering",
        "enterprise-ai",
        "agentic-workflows"
      ],
      "related_registry_entries": [
        "cursor",
        "aider",
        "gpt-engineer"
      ],
      "authority_score": 1.0,
      "virality_score": 0.6408,
      "recency_hours": 79
    },
    {
      "rank": 3,
      "id": "2026-05-10-003",
      "title": "How Chinese developers bypass restrictions to access top US AI models",
      "url": "https://news.google.com/rss/articles/CBMizgFBVV95cUxPWXU2THpScnp3a3E2OF9PWnZTYktWSUpQbUxLU3lfOHFzdTV1T1ZHRWl1VmsyYTI4ZHhISGx3a0pWTlhZaEdyYzN2cTFyVVN0aUNTMEdYYzBSbE5SQUFOcE0tbFNFbnVhdU13MHVNRE1rWVRTb3UxNGVjdnlPWmQ0WDhPbTV0dklKNmx4SXJqeFl2b0NIOEVqNU1lSFZzOGVEZXFWXzBwbXRMOExCbk1ZbUlPWjNoV1ZZcXFweHFjLWhrTTNjZ0h0SzNMd1AzQdIBzgFBVV95cUxOR2ZjRUFiWldvWkx6aGdCMjNHdktxZFlmYkViblZ4NW1ZQ05LU1JrRnpjZlF6V3F4N0RDVUZ4UE9rZFhSdWs5ZnlMOFZTaVpvODRRaHNWYmRaWUdjU0dsY3JtU0RaZ3BuWjBtaWRjSDZ1UDdqNHFreXQtQ3FuekVJdnl6b3Juam9WZlRYaDhNcjZHSU9Ib2plVmRLTXlmMXpPQjVzOG1UcEVLNU1aVGU2aXhBX0FlOGpuX3JteDg3V1NXa3pOYzJGeTF5V0ZlZw?oc=5",
      "source": "google-news-ai",
      "source_type": "news_aggregator",
      "published_at": "2026-05-10T07:00:05+00:00",
      "summary": "South China Morning Post reports on techniques Chinese devs use to circumvent US export controls on advanced AI models like those from OpenAI and Anthropic, enabling access despite restrictions.",
      "why_it_matters": "Reveals enforcement gaps in AI geopolitics, impacting model distribution strategies. Builders must anticipate global access patterns, enhance controls, or design region-agnostic alternatives. Signals rising competition and need for robust compliance in AI tooling.",
      "suggested_reel_angle": "Chinese devs hack US AI bans: What's next for global access?",
      "suggested_long_angle": [
        "Bypass methods exposed",
        "Geopolitical implications for AI",
        "Lessons for model providers"
      ],
      "tags": [
        "geopolitics",
        "ai-access",
        "export-controls",
        "china-us"
      ],
      "related_registry_entries": [],
      "authority_score": 0.6,
      "virality_score": 0.76,
      "recency_hours": 0
    },
    {
      "rank": 4,
      "id": "2026-05-10-004",
      "title": "How frontier firms are pulling ahead",
      "url": "https://openai.com/index/introducing-b2b-signals",
      "source": "openai",
      "source_type": "official_blog",
      "published_at": "2026-05-06T00:00:00+00:00",
      "summary": "OpenAI's B2B Signals research details how leading enterprises scale AI adoption, using Codex-powered agents to gain competitive edges in workflows and operations.",
      "why_it_matters": "Provides data-driven playbook for enterprise AI scaling. Builders learn to prioritize agentic systems like Codex for moats, track adoption benchmarks, and integrate deeply. Essential for B2B AI product development and staying ahead of laggards.",
      "suggested_reel_angle": "Frontier firms dominate AI: OpenAI's B2B secrets revealed!",
      "suggested_long_angle": [
        "Key signals of AI leadership",
        "Codex agent scaling",
        "Building competitive moats"
      ],
      "tags": [
        "enterprise-ai",
        "b2b",
        "codex",
        "agentic"
      ],
      "related_registry_entries": [
        "langsmith",
        "weights-and-biases"
      ],
      "authority_score": 1.0,
      "virality_score": 0.6204,
      "recency_hours": 103
    },
    {
      "rank": 5,
      "id": "2026-05-10-005",
      "title": "Adding Benchmaxxer Repellant to the Open ASR Leaderboard",
      "url": "https://huggingface.co/blog/open-asr-leaderboard-private-data",
      "source": "huggingface",
      "source_type": "official_blog",
      "published_at": "2026-05-06T00:00:00+00:00",
      "summary": "Hugging Face updates Open ASR Leaderboard with private data to repel benchmark contamination, ensuring fairer evaluations of automatic speech recognition models.",
      "why_it_matters": "Combats overfitting to public evals, improving leaderboard reliability for speech AI. Builders get truer model comparisons, refine training to generalize, and trust rankings for production deployment decisions.",
      "suggested_reel_angle": "ASR leaderboard gets anti-cheat: No more benchmaxxing!",
      "suggested_long_angle": [
        "Private data repellant mechanics",
        "Impact on ASR rankings",
        "Better evals for speech AI"
      ],
      "tags": [
        "asr",
        "benchmark",
        "leaderboard",
        "speech-ai"
      ],
      "related_registry_entries": [
        "mmlu",
        "humaneval"
      ],
      "authority_score": 0.9,
      "virality_score": 0.5604,
      "recency_hours": 103
    }
  ]
}