{
  "date": "2026-05-12",
  "generated_at": "2026-05-12T07:16:08.070626+00:00",
  "generator_version": "1.0.0",
  "sources_polled": [
    "openai",
    "anthropic",
    "deepmind",
    "huggingface",
    "google-news-ai",
    "arxiv-cs-ai"
  ],
  "items": [
    {
      "rank": 1,
      "id": "2026-05-12-001",
      "title": "OpenAI launches DeployCo to help businesses build around intelligence",
      "url": "https://openai.com/index/openai-launches-the-deployment-company",
      "source": "openai",
      "source_type": "official_blog",
      "published_at": "2026-05-11T06:00:00+00:00",
      "summary": "OpenAI has launched DeployCo, a new enterprise-focused company designed to help organizations deploy frontier AI models into production. It emphasizes turning AI capabilities into measurable business impact through scalable deployment tools and services.",
      "why_it_matters": "This move signals OpenAI's push into enterprise AI infrastructure, providing builders with production-ready solutions for integrating frontier models. It lowers barriers for non-experts to operationalize AI, potentially standardizing deployment patterns and accelerating ROI-driven adoption across industries. For AI practitioners, it means new APIs, orchestration tools, and best practices tailored for business-scale inference and agentic workflows.",
      "suggested_reel_angle": "OpenAI drops DeployCo: the enterprise AI deployment powerhouse! Turn frontier models into business wins. \ud83d\ude80",
      "suggested_long_angle": [
        "DeployCo's mission and OpenAI backing",
        "Core tools for production AI",
        "Why enterprises need this now"
      ],
      "tags": [
        "openai",
        "enterprise",
        "deployment",
        "production"
      ],
      "related_registry_entries": [
        "langgraph",
        "autogen-04"
      ],
      "authority_score": 1.0,
      "virality_score": 0.7943,
      "recency_hours": 25
    },
    {
      "rank": 2,
      "id": "2026-05-12-002",
      "title": "How ChatGPT adoption broadened in early 2026",
      "url": "https://openai.com/signals/research/2026q1-update",
      "source": "openai",
      "source_type": "official_blog",
      "published_at": "2026-05-11T15:00:00+00:00",
      "summary": "ChatGPT saw surging adoption in Q1 2026, with the fastest growth among users over 35 and more balanced gender distribution, indicating AI tools are reaching a broader mainstream audience beyond early tech adopters.",
      "why_it_matters": "Demographic shifts reveal maturing AI usage patterns, guiding builders on user needs like intuitive interfaces for older users and diverse applications. This data informs product design, marketing, and scaling strategies, highlighting opportunities in sectors like education, healthcare, and professional services where mainstream adoption drives demand for custom integrations and fine-tuned models.",
      "suggested_reel_angle": "ChatGPT explodes among 35+ users in 2026! AI goes fully mainstream. \ud83d\udcc8",
      "suggested_long_angle": [
        "Q1 adoption metrics breakdown",
        "Key demographic changes",
        "Opportunities for AI builders"
      ],
      "tags": [
        "openai",
        "chatgpt",
        "adoption",
        "mainstream"
      ],
      "related_registry_entries": [],
      "authority_score": 1.0,
      "virality_score": 0.852,
      "recency_hours": 16
    },
    {
      "rank": 3,
      "id": "2026-05-12-003",
      "title": "Building Blocks for Foundation Model Training and Inference on AWS",
      "url": "https://huggingface.co/blog/amazon/foundation-model-building-blocks",
      "source": "huggingface",
      "source_type": "official_blog",
      "published_at": "2026-05-11T23:18:26+00:00",
      "summary": "Hugging Face introduces modular building blocks on AWS for efficient training and inference of foundation models, streamlining cloud-based workflows for scaling large AI systems.",
      "why_it_matters": "These tools democratize access to high-performance FM development on AWS, offering optimized components for data prep, training loops, and serving. Builders gain cost-effective, scalable infrastructure without deep cloud expertise, fostering faster experimentation and deployment of custom models in production environments.",
      "suggested_reel_angle": "AWS + Hugging Face unlock easy foundation model training! Scale your AI effortlessly. \u2601\ufe0f",
      "suggested_long_angle": [
        "Overview of training blocks",
        "Inference optimizations",
        "Hands-on AWS integration"
      ],
      "tags": [
        "huggingface",
        "aws",
        "training",
        "inference",
        "infrastructure"
      ],
      "related_registry_entries": [
        "vllm",
        "weights-and-biases"
      ],
      "authority_score": 0.9,
      "virality_score": 0.8668,
      "recency_hours": 7
    },
    {
      "rank": 4,
      "id": "2026-05-12-004",
      "title": "Where Reliability Lives in Vision-Language Models: A Mechanistic Study of Attention, Hidden States, and Causal Circuits",
      "url": "https://arxiv.org/abs/2605.08200",
      "source": "arxiv-cs-ai",
      "source_type": "research",
      "published_at": "2026-05-12T04:00:00+00:00",
      "summary": "This arXiv paper conducts a mechanistic analysis of VLMs (LLaVA-1.5, PaliGemma, Qwen2-VL), testing the assumption that sharp attention correlates with confident, reliable outputs. It explores attention maps, hidden states, and causal circuits for trustworthiness insights.",
      "why_it_matters": "Interpretability is crucial for deploying VLMs safely. Findings challenge intuitions, helping builders debug reliability issues, design better training objectives, and build trust metrics. This advances VLM engineering toward production-grade vision-language applications like robotics and medical imaging.",
      "suggested_reel_angle": "Sharp attention = reliable VLM? Groundbreaking study reveals the truth! \ud83d\udd0d",
      "suggested_long_angle": [
        "Testing attention-confidence myth",
        "Mechanistic findings in VLMs",
        "Takeaways for model builders"
      ],
      "tags": [
        "vlm",
        "interpretability",
        "research",
        "reliability",
        "mechanistic"
      ],
      "related_registry_entries": [
        "gemini-2-5-pro"
      ],
      "authority_score": 0.8,
      "virality_score": 0.8468,
      "recency_hours": 3
    },
    {
      "rank": 5,
      "id": "2026-05-12-005",
      "title": "Auto-Rubric as Reward: From Implicit Preferences to Explicit Multimodal Generative Criteria",
      "url": "https://arxiv.org/abs/2605.08354",
      "source": "arxiv-cs-ai",
      "source_type": "research",
      "published_at": "2026-05-12T04:00:00+00:00",
      "summary": "New research introduces Auto-Rubric, generating explicit, multi-dimensional rubrics from human preferences as reward signals for aligning multimodal generative models, mitigating reward hacking in RLHF.",
      "why_it_matters": "Current RLHF collapses complex judgments into scalars, risking misalignment. Auto-Rubric preserves structure for compositional evaluation, enabling robust alignment of image/video/text generators. Builders can implement this for safer, more controllable multimodal AI in creative and decision-making tools.",
      "suggested_reel_angle": "End reward hacking in multimodal AI with Auto-Rubric! Smarter alignment ahead. \ud83d\udee1\ufe0f",
      "suggested_long_angle": [
        "RLHF limitations exposed",
        "How Auto-Rubric works",
        "Benchmark results and code"
      ],
      "tags": [
        "alignment",
        "rlhf",
        "multimodal",
        "reward-model",
        "research"
      ],
      "related_registry_entries": [
        "constitutional-ai",
        "lmsys-chatbot-arena"
      ],
      "authority_score": 0.8,
      "virality_score": 0.8468,
      "recency_hours": 3
    }
  ]
}