{
  "date": "2026-05-11",
  "generated_at": "2026-05-11T07:33:42.037896+00:00",
  "generator_version": "1.0.0",
  "sources_polled": [
    "openai",
    "anthropic",
    "deepmind",
    "huggingface",
    "google-news-ai",
    "arxiv-cs-ai"
  ],
  "items": [
    {
      "rank": 1,
      "id": "2026-05-11-001",
      "title": "How enterprises are scaling AI",
      "url": "https://openai.com/business/guides-and-resources/how-enterprises-are-scaling-ai",
      "source": "openai",
      "source_type": "official_blog",
      "published_at": "2026-05-11T10:00:00+00:00",
      "summary": "OpenAI details enterprise AI scaling from initial experiments to sustained impact, emphasizing trust-building, governance frameworks, workflow integration, and maintaining quality at scale for production deployments.",
      "why_it_matters": "AI builders gain actionable strategies from OpenAI on overcoming scaling hurdles like governance and workflows, enabling faster enterprise adoption and compounding ROI. Critical for leaders transitioning pilots to enterprise-grade systems with reliability and compliance.",
      "suggested_reel_angle": "OpenAI reveals enterprise AI scaling secrets: trust, governance, workflows. From experiments to impact!",
      "suggested_long_angle": [
        "Building Trust and Governance",
        "Designing Scalable Workflows",
        "Ensuring Quality at Scale"
      ],
      "tags": [
        "openai",
        "enterprise",
        "scaling",
        "governance"
      ],
      "related_registry_entries": [],
      "authority_score": 1.0,
      "virality_score": 1.0,
      "recency_hours": 0
    },
    {
      "rank": 2,
      "id": "2026-05-11-002",
      "title": "OpenAI Campus Network: Student club interest form",
      "url": "https://openai.com/index/openai-campus-network-student-club-interest-form",
      "source": "openai",
      "source_type": "official_blog",
      "published_at": "2026-05-11T10:00:00+00:00",
      "summary": "OpenAI launches Campus Network to unite global student AI clubs, providing exclusive tools, event support, and resources to foster AI-powered campus communities and hands-on projects.",
      "why_it_matters": "Empowers future AI builders with direct OpenAI access, accelerating talent pipelines through clubs, tools, and events. Builders can engage students early, prototype campus apps, and build ecosystems for innovation.",
      "suggested_reel_angle": "OpenAI Campus Network: Free AI tools and events for student clubs worldwide!",
      "suggested_long_angle": [
        "Connecting Global Student Clubs",
        "Exclusive AI Tool Access",
        "Hosting Campus AI Events"
      ],
      "tags": [
        "openai",
        "community",
        "education",
        "students"
      ],
      "related_registry_entries": [
        "deeplearning-ai-short-courses"
      ],
      "authority_score": 1.0,
      "virality_score": 1.0,
      "recency_hours": 0
    },
    {
      "rank": 3,
      "id": "2026-05-11-003",
      "title": "GraphDC: A Divide-and-Conquer Multi-Agent System for Scalable Graph Algorithm Reasoning",
      "url": "https://arxiv.org/abs/2605.06671",
      "source": "arxiv-cs-ai",
      "source_type": "research",
      "published_at": "2026-05-11T04:00:00+00:00",
      "summary": "GraphDC introduces a multi-agent divide-and-conquer framework for LLMs to tackle complex graph algorithms, enabling systematic multi-step reasoning on large-scale graphs where single LLMs fail.",
      "why_it_matters": "Breakthrough for graph reasoning, a LLM weak spot. Builders can implement multi-agent systems for topology-heavy tasks like networks or molecules, scaling to real-world graph sizes with better accuracy.",
      "suggested_reel_angle": "GraphDC: Multi-agents make LLMs graph reasoning pros on huge datasets!",
      "suggested_long_angle": [
        "LLM Limits on Graphs",
        "Divide-and-Conquer Multi-Agents",
        "Scaling to Large Graphs"
      ],
      "tags": [
        "research",
        "multi-agent",
        "graphs",
        "reasoning"
      ],
      "related_registry_entries": [
        "autogen-04",
        "langgraph"
      ],
      "authority_score": 0.8,
      "virality_score": 0.8468,
      "recency_hours": 3
    },
    {
      "rank": 4,
      "id": "2026-05-11-004",
      "title": "MachinaCheck: Building a Multi-Agent CNC Manufacturability System on AMD MI300X",
      "url": "https://huggingface.co/blog/lablab-ai-amd-developer-hackathon/machinacheck",
      "source": "huggingface",
      "source_type": "official_blog",
      "published_at": "2026-05-10T18:44:11+00:00",
      "summary": "Hackathon project deploys multi-agent system on AMD MI300X GPUs for CNC manufacturability checks, integrating AI agents for design validation, simulation, and optimization in hardware workflows.",
      "why_it_matters": "Proves multi-agent AI viability in manufacturing with high-perf hardware. Builders get blueprint for agentic production tools, leveraging AMD GPUs for real-time checks and bridging AI with physical fabrication.",
      "suggested_reel_angle": "Multi-agent AI on AMD MI300X revolutionizes CNC manufacturing checks!",
      "suggested_long_angle": [
        "Multi-Agent CNC Workflow",
        "AMD MI300X Integration",
        "Hackathon to Production"
      ],
      "tags": [
        "multi-agent",
        "manufacturing",
        "hardware",
        "huggingface"
      ],
      "related_registry_entries": [
        "autogen-04"
      ],
      "authority_score": 0.9,
      "virality_score": 0.8228,
      "recency_hours": 12
    },
    {
      "rank": 5,
      "id": "2026-05-11-005",
      "title": "More Thinking, More Bias: Length-Driven Position Bias in Reasoning Models",
      "url": "https://arxiv.org/abs/2605.06672",
      "source": "arxiv-cs-ai",
      "source_type": "research",
      "published_at": "2026-05-11T04:00:00+00:00",
      "summary": "Research shows reasoning models like DeepSeek-R1 exhibit increasing position bias in multiple-choice QA as chain-of-thought length grows, challenging assumptions about longer reasoning reducing heuristics.",
      "why_it_matters": "Exposes flaw in CoT prompting: more steps amplify biases. Essential for model trainers and prompt engineers to mitigate via debiasing or eval tweaks, improving reliability in reasoning tasks.",
      "suggested_reel_angle": "Shocking: Longer AI reasoning boosts bias, not fixes it! New arXiv find.",
      "suggested_long_angle": [
        "Position Bias in CoT",
        "Evidence from DeepSeek-R1",
        "Fixes for Reasoning Models"
      ],
      "tags": [
        "research",
        "bias",
        "reasoning",
        "chain-of-thought"
      ],
      "related_registry_entries": [
        "chain-of-thought-prompting"
      ],
      "authority_score": 0.8,
      "virality_score": 0.8468,
      "recency_hours": 3
    }
  ]
}