{
  "date": "2026-05-04",
  "generated_at": "2026-05-04T07:20:31.602980+00:00",
  "generator_version": "1.0.0",
  "sources_polled": [
    "openai",
    "anthropic",
    "deepmind",
    "huggingface",
    "google-news-ai",
    "arxiv-cs-ai"
  ],
  "items": [
    {
      "rank": 1,
      "id": "2026-05-04-001",
      "title": "SK Group Joins Corporate Korea's Move to Reorganize Work Around AI Agents",
      "url": "https://news.google.com/rss/articles/CBMif0FVX3lxTFA5RlFaakdnUUVZY0hHcUl5MDFpWTFGZjZxcnlsckhkTlViVTNlaHhfQ3N5SHdpZGQwOWYxdVpBQWFmTWdzdVBXT2c4R3MtbmlKOVhOZmdNekM5VlI2dWp5eUFkNklmNnoxbUdJX0FLUUpmMzdVeWVKVzkwV1N6Y1E?oc=5",
      "source": "google-news-ai",
      "source_type": "news_aggregator",
      "published_at": "2026-05-04T06:51:40+00:00",
      "summary": "SK Group, a leading South Korean conglomerate, is restructuring its operations to integrate AI agents at the core of workflows, joining other major Korean firms in this shift toward agent-driven productivity.",
      "why_it_matters": "This signals a massive enterprise pivot to AI agents, validating builder efforts in multi-agent systems. Expect surging demand for reliable, scalable agent orchestration tools that handle complex tasks, integrate with enterprise software, and deliver ROI at chaebol scale. Builders should prioritize stateful agents, error recovery, and tool integrations to capture this market.",
      "suggested_reel_angle": "SK Group rebuilds its empire around AI agents - is your workflow next?",
      "suggested_long_angle": [
        "Details of SK's AI agent reorganization",
        "Broader Korean corporate AI trend",
        "Essential tools for enterprise AI agents"
      ],
      "tags": [
        "ai-agents",
        "enterprise-adoption",
        "workflow-reorganization"
      ],
      "related_registry_entries": [
        "autogen-04",
        "langgraph"
      ],
      "authority_score": 0.6,
      "virality_score": 0.76,
      "recency_hours": 0
    },
    {
      "rank": 2,
      "id": "2026-05-04-002",
      "title": "Workspace Agents: Build, Use, and Scale in ChatGPT",
      "url": "https://openai.com/academy/workspace-agents",
      "source": "openai",
      "source_type": "official_blog",
      "published_at": "2026-04-22T10:00:00+00:00",
      "summary": "OpenAI's guide on creating workspace agents in ChatGPT to automate repeatable workflows, connect external tools, and optimize team collaboration.",
      "why_it_matters": "Empowers builders to deploy production-grade agents within ChatGPT ecosystem, bridging prototyping to scaling. Key for developing team-scale automations with tool-calling, state management, and multi-agent coordination, accelerating adoption in dev teams and businesses.",
      "suggested_reel_angle": "Scale AI agents across your team with OpenAI's workspace magic!",
      "suggested_long_angle": [
        "Building your first workspace agent",
        "Tool integrations and scaling tips",
        "Team workflow transformation cases"
      ],
      "tags": [
        "openai",
        "ai-agents",
        "chatgpt",
        "automation"
      ],
      "related_registry_entries": [
        "langgraph",
        "autogen-04",
        "model-context-protocol"
      ],
      "authority_score": 1.0,
      "virality_score": 0.6001,
      "recency_hours": 285
    },
    {
      "rank": 3,
      "id": "2026-05-04-003",
      "title": "Introducing OpenAI Privacy Filter",
      "url": "https://openai.com/index/introducing-openai-privacy-filter",
      "source": "openai",
      "source_type": "official_blog",
      "published_at": "2026-04-22T00:00:00+00:00",
      "summary": "OpenAI launches Privacy Filter, an open-weight model achieving state-of-the-art accuracy in detecting and redacting personally identifiable information (PII) from text.",
      "why_it_matters": "Critical for compliant AI apps handling user data. Builders gain a high-performance, self-hostable PII filter, reducing reliance on external services, enabling on-device privacy, and simplifying GDPR/CCPA adherence in RAG pipelines, chatbots, and data processing tools.",
      "suggested_reel_angle": "OpenAI drops open-weight PII shield - privacy solved!",
      "suggested_long_angle": [
        "Privacy Filter capabilities and benchmarks",
        "Integration into AI pipelines",
        "Impact on production safety"
      ],
      "tags": [
        "openai",
        "privacy",
        "pii-redaction",
        "open-weight"
      ],
      "related_registry_entries": [
        "constitutional-ai"
      ],
      "authority_score": 1.0,
      "virality_score": 0.6001,
      "recency_hours": 295
    },
    {
      "rank": 4,
      "id": "2026-05-04-004",
      "title": "SUNY Establishes Systemwide AI Policy",
      "url": "https://news.google.com/rss/articles/CBMiqwFBVV95cUxPNHNWaG43dHl3WEVXV0FJWjN0MlpRRWsxQzlsTW1IYUlMLUtXZzcyQU03VjZ0WUNvLWotRjZ1aFZTRUM1MldpNnM0ZlBMT1RnVEZ2eGNlVER1UzA3UEczaUhIdXdiZWJBaUxzaVRyMVQ2aUVHSDZ2RTF1RzIxZU5laTdlQ2RLbVNidTlTWnJqbEFMa2IzVTRKUHNvcy1fcnhXaXk0bjBvQS1NdG8?oc=5",
      "source": "google-news-ai",
      "source_type": "news_aggregator",
      "published_at": "2026-05-04T07:01:15+00:00",
      "summary": "State University of New York (SUNY), spanning 64 campuses, implements a unified AI policy addressing usage in teaching, research, and administration.",
      "why_it_matters": "Sets precedent for large-scale institutional AI governance. Builders can design compliant edtech tools, research platforms, and agentic tutors aligned with academic standards, opening opportunities in higher ed AI integration and ethical deployment frameworks.",
      "suggested_reel_angle": "SUNY's AI policy hits 64 campuses - blueprint for education?",
      "suggested_long_angle": [
        "Core components of SUNY's AI policy",
        "Implications for academic AI tools",
        "Builder opportunities in edtech"
      ],
      "tags": [
        "ai-policy",
        "education",
        "higher-ed",
        "ethics"
      ],
      "related_registry_entries": [],
      "authority_score": 0.6,
      "virality_score": 0.76,
      "recency_hours": 0
    },
    {
      "rank": 5,
      "id": "2026-05-04-005",
      "title": "Codex Settings: Configuration Guide",
      "url": "https://openai.com/academy/codex-settings",
      "source": "openai",
      "source_type": "official_blog",
      "published_at": "2026-04-23T10:00:00+00:00",
      "summary": "OpenAI explains Codex configuration options for personalization, detail levels, permissions, and workflow optimization in code generation tasks.",
      "why_it_matters": "Unlocks fine-tuned control over Codex for superior code outputs. Essential for builders crafting IDE plugins, code assistants, and automation scripts, improving accuracy, security, and customization in AI-driven development pipelines.",
      "suggested_reel_angle": "Master Codex settings for pro-level code gen!",
      "suggested_long_angle": [
        "Key Codex configuration options",
        "Personalization and permissions",
        "Optimizing for dev workflows"
      ],
      "tags": [
        "openai",
        "codex",
        "code-generation",
        "configuration"
      ],
      "related_registry_entries": [
        "humaneval",
        "cursor"
      ],
      "authority_score": 1.0,
      "virality_score": 0.6002,
      "recency_hours": 261
    }
  ]
}